{
  "schemaVersion": "guardrail-fabric.wallguard-guardrail-binding.v0.1",
  "recordType": "WallGuardGuardrailBinding",
  "binding_id": "wallguard-guardrail-binding:allow-001",
  "source_system": "SocioProphet/guardrail-fabric",
  "surface": "tool_invocation",
  "wall_decision_ref": "wallguard-decision://same-wall-tool-allow-001",
  "wall_decision_outcome": "allow",
  "guardrail_action": "allow",
  "resource_refs": ["resource://client-a/matter-x/doc-001"],
  "destination_ref": "workroom://client-a/matter-x",
  "policy_refs": ["policy-fabric://wallguard.professional-workroom.v0"],
  "receipt_refs": ["wallguard-receipt://same-wall-tool-allow-001"],
  "reason": "same wall tool invocation permitted by WallGuard decision",
  "issued_at": "2026-05-30T00:00:00Z",
  "authority_mutation": {
    "performed": false,
    "authority_plane": "SocioProphet/agent-registry",
    "downstream_intent": "none"
  }
}
